[
  {
    "id": "seed-001",
    "title": "Auriculares inalámbricos Bluetooth 5.0",
    "description": "Auriculares con cancelación de ruido, batería 20h.",
    "price_pyg": 185000,
    "store": "Tienda Demo",
    "store_id": "demo-1",
    "url": "https://example.com/producto/1",
    "image_url": "https://via.placeholder.com/300x300?text=Auriculares",
    "category": "Electrónica",
    "source": "seed",
    "source_id": "1",
    "locale": "es-PY",
    "currency": "PYG",
    "ingested_at": "2026-03-03T12:00:00Z",
    "updated_at": "2026-03-03T12:00:00Z"
  },
  {
    "id": "seed-002",
    "title": "Smartphone liberado 128GB",
    "description": "Pantalla 6.5\", cámara triple, batería 5000mAh.",
    "price_pyg": 1250000,
    "store": "Tienda Demo",
    "store_id": "demo-1",
    "url": "https://example.com/producto/2",
    "image_url": "https://via.placeholder.com/300x300?text=Smartphone",
    "category": "Celulares",
    "source": "seed",
    "source_id": "2",
    "locale": "es-PY",
    "currency": "PYG",
    "ingested_at": "2026-03-03T12:00:00Z",
    "updated_at": "2026-03-03T12:00:00Z"
  },
  {
    "id": "seed-003",
    "title": "Notebook 15.6\" 8GB RAM 256GB SSD",
    "description": "Ideal para trabajo y estudio, Windows 11.",
    "price_pyg": 2850000,
    "store": "Tienda Demo",
    "store_id": "demo-1",
    "url": "https://example.com/producto/3",
    "image_url": "https://via.placeholder.com/300x300?text=Notebook",
    "category": "Computación",
    "source": "seed",
    "source_id": "3",
    "locale": "es-PY",
    "currency": "PYG",
    "ingested_at": "2026-03-03T12:00:00Z",
    "updated_at": "2026-03-03T12:00:00Z"
  },
  {
    "id": "seed-004",
    "title": "Tablet 10\" 64GB WiFi",
    "description": "Pantalla Full HD, ideal para ver series y navegar.",
    "price_pyg": 890000,
    "store": "Electrónica Py",
    "store_id": "ep-1",
    "url": "https://example.com/producto/4",
    "image_url": "https://via.placeholder.com/300x300?text=Tablet",
    "category": "Electrónica",
    "source": "seed",
    "source_id": "4",
    "locale": "es-PY",
    "currency": "PYG",
    "ingested_at": "2026-03-03T12:00:00Z",
    "updated_at": "2026-03-03T12:00:00Z"
  },
  {
    "id": "seed-005",
    "title": "Celular dual SIM 32GB",
    "description": "Batería 4000mAh, cámara 13MP, pantalla 6.2\".",
    "price_pyg": 420000,
    "store": "Electrónica Py",
    "store_id": "ep-2",
    "url": "https://example.com/producto/5",
    "image_url": "https://via.placeholder.com/300x300?text=Celular",
    "category": "Celulares",
    "source": "seed",
    "source_id": "5",
    "locale": "es-PY",
    "currency": "PYG",
    "ingested_at": "2026-03-03T12:00:00Z",
    "updated_at": "2026-03-03T12:00:00Z"
  },
  {
    "id": "seed-006",
    "title": "Teclado y mouse inalámbricos",
    "description": "Combo USB, diseño ergonómico, pilas incluidas.",
    "price_pyg": 145000,
    "store": "MegaShop",
    "store_id": "ms-1",
    "url": "https://example.com/producto/6",
    "image_url": "https://via.placeholder.com/300x300?text=Teclado",
    "category": "Computación",
    "source": "seed",
    "source_id": "6",
    "locale": "es-PY",
    "currency": "PYG",
    "ingested_at": "2026-03-03T12:00:00Z",
    "updated_at": "2026-03-03T12:00:00Z"
  },
  {
    "id": "seed-007",
    "title": "Smart TV 43\" Full HD",
    "description": "Android TV, 3 HDMI, WiFi, Netflix y YouTube.",
    "price_pyg": 1950000,
    "store": "MegaShop",
    "store_id": "ms-2",
    "url": "https://example.com/producto/7",
    "image_url": "https://via.placeholder.com/300x300?text=TV",
    "category": "Electrónica",
    "source": "seed",
    "source_id": "7",
    "locale": "es-PY",
    "currency": "PYG",
    "ingested_at": "2026-03-03T12:00:00Z",
    "updated_at": "2026-03-03T12:00:00Z"
  },
  {
    "id": "seed-008",
    "title": "Cargador rápido 25W",
    "description": "Compatible con celulares y tablets, carga rápida.",
    "price_pyg": 65000,
    "store": "Tienda Demo",
    "store_id": "demo-2",
    "url": "https://example.com/producto/8",
    "image_url": "https://via.placeholder.com/300x300?text=Cargador",
    "category": "Electrónica",
    "source": "seed",
    "source_id": "8",
    "locale": "es-PY",
    "currency": "PYG",
    "ingested_at": "2026-03-03T12:00:00Z",
    "updated_at": "2026-03-03T12:00:00Z"
  },
  {
    "id": "seed-009",
    "title": "Parlante Bluetooth portátil",
    "description": "Resistente al agua IPX5, batería 12h, 10W.",
    "price_pyg": 220000,
    "store": "CasaTech",
    "store_id": "ct-1",
    "url": "https://example.com/producto/9",
    "image_url": "https://via.placeholder.com/300x300?text=Parlante",
    "category": "Electrónica",
    "source": "seed",
    "source_id": "9",
    "locale": "es-PY",
    "currency": "PYG",
    "ingested_at": "2026-03-03T12:00:00Z",
    "updated_at": "2026-03-03T12:00:00Z"
  },
  {
    "id": "seed-010",
    "title": "Monitor 24\" LED Full HD",
    "description": "HDMI y VGA, antirreflejo, ideal para oficina.",
    "price_pyg": 780000,
    "store": "CasaTech",
    "store_id": "ct-2",
    "url": "https://example.com/producto/10",
    "image_url": "https://via.placeholder.com/300x300?text=Monitor",
    "category": "Computación",
    "source": "seed",
    "source_id": "10",
    "locale": "es-PY",
    "currency": "PYG",
    "ingested_at": "2026-03-03T12:00:00Z",
    "updated_at": "2026-03-03T12:00:00Z"
  },
  {
    "id": "seed-011",
    "title": "iPhone usado 64GB",
    "description": "Buen estado, batería reemplazada, liberado.",
    "price_pyg": 2100000,
    "store": "Electrónica Py",
    "store_id": "ep-3",
    "url": "https://example.com/producto/11",
    "image_url": "https://via.placeholder.com/300x300?text=iPhone",
    "category": "Celulares",
    "source": "seed",
    "source_id": "11",
    "locale": "es-PY",
    "currency": "PYG",
    "ingested_at": "2026-03-03T12:00:00Z",
    "updated_at": "2026-03-03T12:00:00Z"
  },
  {
    "id": "seed-012",
    "title": "Webcam HD 1080p",
    "description": "Micrófono integrado, para videollamadas y streaming.",
    "price_pyg": 185000,
    "store": "MegaShop",
    "store_id": "ms-3",
    "url": "https://example.com/producto/12",
    "image_url": "https://via.placeholder.com/300x300?text=Webcam",
    "category": "Computación",
    "source": "seed",
    "source_id": "12",
    "locale": "es-PY",
    "currency": "PYG",
    "ingested_at": "2026-03-03T12:00:00Z",
    "updated_at": "2026-03-03T12:00:00Z"
  },
  {
    "id": "seed-013",
    "title": "Ventilador de pie 18\"",
    "description": "3 velocidades, oscilante, bajo consumo.",
    "price_pyg": 125000,
    "store": "CasaTech",
    "store_id": "ct-3",
    "url": "https://example.com/producto/13",
    "image_url": "https://via.placeholder.com/300x300?text=Ventilador",
    "category": "Hogar",
    "source": "seed",
    "source_id": "13",
    "locale": "es-PY",
    "currency": "PYG",
    "ingested_at": "2026-03-03T12:00:00Z",
    "updated_at": "2026-03-03T12:00:00Z"
  },
  {
    "id": "seed-014",
    "title": "Cafetera 12 tazas",
    "description": "Filtro permanente, apagado automático.",
    "price_pyg": 195000,
    "store": "Tienda Demo",
    "store_id": "demo-3",
    "url": "https://example.com/producto/14",
    "image_url": "https://via.placeholder.com/300x300?text=Cafetera",
    "category": "Hogar",
    "source": "seed",
    "source_id": "14",
    "locale": "es-PY",
    "currency": "PYG",
    "ingested_at": "2026-03-03T12:00:00Z",
    "updated_at": "2026-03-03T12:00:00Z"
  },
  {
    "id": "seed-015",
    "title": "Zapatilla deportiva running",
    "description": "Talla 38 a 44, suela antideslizante.",
    "price_pyg": 320000,
    "store": "MegaShop",
    "store_id": "ms-4",
    "url": "https://example.com/producto/15",
    "image_url": "https://via.placeholder.com/300x300?text=Zapatilla",
    "category": "Deportes",
    "source": "seed",
    "source_id": "15",
    "locale": "es-PY",
    "currency": "PYG",
    "ingested_at": "2026-03-03T12:00:00Z",
    "updated_at": "2026-03-03T12:00:00Z"
  },
  {
    "id": "seed-016",
    "title": "Pelota de fútbol N°5",
    "description": "Material sintético, uso profesional y amateur.",
    "price_pyg": 85000,
    "store": "Tienda Demo",
    "store_id": "demo-4",
    "url": "https://example.com/producto/16",
    "image_url": "https://via.placeholder.com/300x300?text=Pelota",
    "category": "Deportes",
    "source": "seed",
    "source_id": "16",
    "locale": "es-PY",
    "currency": "PYG",
    "ingested_at": "2026-03-03T12:00:00Z",
    "updated_at": "2026-03-03T12:00:00Z"
  },
  {
    "id": "seed-017",
    "title": "Mochila laptop 15\"",
    "description": "Compartimento acolchado, bolsillo para celular.",
    "price_pyg": 165000,
    "store": "CasaTech",
    "store_id": "ct-4",
    "url": "https://example.com/producto/17",
    "image_url": "https://via.placeholder.com/300x300?text=Mochila",
    "category": "Computación",
    "source": "seed",
    "source_id": "17",
    "locale": "es-PY",
    "currency": "PYG",
    "ingested_at": "2026-03-03T12:00:00Z",
    "updated_at": "2026-03-03T12:00:00Z"
  },
  {
    "id": "seed-018",
    "title": "Reloj inteligente con GPS",
    "description": "Monitoreo de ritmo cardíaco, resistencia al agua.",
    "price_pyg": 450000,
    "store": "Electrónica Py",
    "store_id": "ep-4",
    "url": "https://example.com/producto/18",
    "image_url": "https://via.placeholder.com/300x300?text=Reloj",
    "category": "Electrónica",
    "source": "seed",
    "source_id": "18",
    "locale": "es-PY",
    "currency": "PYG",
    "ingested_at": "2026-03-03T12:00:00Z",
    "updated_at": "2026-03-03T12:00:00Z"
  },
  {
    "id": "seed-019",
    "title": "Auriculares gamer con micrófono",
    "description": "7.1 virtual, LED RGB, cable 2m.",
    "price_pyg": 245000,
    "store": "MegaShop",
    "store_id": "ms-5",
    "url": "https://example.com/producto/19",
    "image_url": "https://via.placeholder.com/300x300?text=Auriculares+Gamer",
    "category": "Electrónica",